{
  "status": "pass",
  "coverage_percent": 100.0,
  "evidence_rows": [
    {
      "anomaly_id": "L2-008-SPLIT-001",
      "record_ids": [
        "R004212",
        "R004213"
      ],
      "citations": [
        {
          "doc_id": "01_expense_reimbursement_2025.md",
          "clause_no": "第十一条"
        },
        {
          "doc_id": "03_authorization_management.md",
          "clause_no": "附件二"
        }
      ],
      "facts": [
        "R004212: E0009张婷, travel_lodging, ¥5,100, 2025-04-10, 发票FP2025X0004206, 安程酒店, 7晚, city_tier A, 审批AR-02仅部门经理",
        "R004213: E0009张婷, travel_lodging, ¥5,100, 2025-04-15, 发票FP2025X0004207, 安程酒店, 7晚, city_tier A, 审批AR-02仅部门经理",
        "两笔记录同员工、同费用类型、同供应商、同理由“项目现场住宿费”、间隔5天（≤7天窗口）",
        "合计金额¥10,200达到附件二AR-03审批线(≥10,000)，但被拆分为两笔各¥5,100走AR-02审批线",
        "制度第十一条明确禁止将同一事项拆分为多笔报销以规避审批权限"
      ],
      "fact_supported": true,
      "rule_supported": true,
      "coverage_status": "pass"
    }
  ],
  "candidate_record_ids": [
    "R004212",
    "R004213"
  ],
  "submitted_record_ids": [
    "R004212",
    "R004213"
  ],
  "unowned_record_ids": [],
  "unused_candidate_record_ids": [],
  "unused_citations": [],
  "missing_evidence": [],
  "no_anomaly_coverage": {},
  "reconciled_figures": {
    "total_combined_amount": 10200.0,
    "date_window_start": "2025-04-10",
    "date_window_end": "2025-04-15",
    "days_between": 5,
    "approval_tier_individual": "AR-02",
    "approval_tier_combined": "AR-03"
  },
  "unresolved_items": []
}