{
  "status": "pass",
  "coverage_percent": 100,
  "evidence_rows": [
    {
      "anomaly_id": "POLICY_DISAMBIGUATION_TRAVEL_VS_TRAINING",
      "record_ids": ["R000009", "R000001"],
      "citations": [
        {"doc_id": "04_travel_expense.md", "clause_no": "第三条"},
        {"doc_id": "04_travel_expense.md", "clause_no": "第四条"},
        {"doc_id": "04_travel_expense.md", "clause_no": "第七条"},
        {"doc_id": "05_training_expense.md", "clause_no": "第五条"},
        {"doc_id": "05_training_expense.md", "clause_no": "第六条"},
        {"doc_id": "01_expense_reimbursement_2025.md", "clause_no": "第二条"},
        {"doc_id": "01_expense_reimbursement_2025.md", "clause_no": "第六条"}
      ],
      "facts": [
        "差旅住宿标准（04_travel_expense.md第四条）按员工职级（员工级、经理级、部门负责人级、高管级）×城市档位（一类、二类、三类）双维度确定，形成4×3矩阵",
        "培训住宿标准（05_training_expense.md第五条）仅按城市档位（一类、二类、三类）单维度确定，不区分职级",
        "差旅住宿标准范围：一类300-1100元、二类380-900元、三类300-750元（按职级不同）",
        "培训住宿标准：一类500元、二类420元、三类350元（统一标准）",
        "04_travel_expense.md第七条明确规定培训期间住宿不适用差旅住宿表，应按培训费管理办法执行",
        "05_training_expense.md第六条明确规定培训住宿标准仅适用于培训期间住宿，不得与差旅住宿标准混用",
        "两套制度发文字号不同：差旅为XX证行规〔2025〕丁号，培训为XX证人规〔2025〕戊号，制度独立"
      ],
      "fact_supported": true,
      "rule_supported": true,
      "coverage_status": "pass"
    }
  ],
  "candidate_record_ids": ["R000009", "R000001"],
  "submitted_record_ids": ["R000009", "R000001"],
  "unowned_record_ids": [],
  "unused_candidate_record_ids": [],
  "unused_citations": [],
  "missing_evidence": [],
  "no_anomaly_coverage": {
    "covered_rules": ["04_travel_expense.md 第三/四/七条", "05_training_expense.md 第五/六条"],
    "explanation": "任务要求比较差旅住宿与培训住宿的制度差异，涉及的全部制度条款均已获取完整文本作为证据"
  },
  "reconciled_figures": {
    "travel_lodging": {"一类城市_员工级": 450, "一类城市_经理级": 650, "一类城市_部门负责人级": 850, "一类城市_高管级": 1100, "二类城市_员工级": 380, "二类城市_经理级": 550, "二类城市_部门负责人级": 700, "二类城市_高管级": 900, "三类城市_员工级": 300, "三类城市_经理级": 450, "三类城市_部门负责人级": 600, "三类城市_高管级": 750},
    "training_lodging": {"一类城市": 500, "二类城市": 420, "三类城市": 350}
  },
  "unresolved_items": []
}
