{
  "status": "pass",
  "coverage_percent": 100,
  "evidence_rows": [
    {
      "anomaly_id": "L3-010-VT-001",
      "record_ids": [
        "R004233"
      ],
      "citations": [
        {
          "doc_id": "01_expense_reimbursement_2025.md",
          "clause_no": "第五条"
        },
        {
          "doc_id": "01_expense_reimbursement_2025.md",
          "clause_no": "第十四条"
        },
        {
          "doc_id": "02_expense_reimbursement_2022_deprecated.md",
          "clause_no": "第一条"
        },
        {
          "doc_id": "02_expense_reimbursement_2022_deprecated.md",
          "clause_no": "第二条"
        },
        {
          "doc_id": "02_expense_reimbursement_2022_deprecated.md",
          "clause_no": "第三条"
        },
        {
          "doc_id": "02_expense_reimbursement_2022_deprecated.md",
          "clause_no": "第四条"
        },
        {
          "doc_id": "03_authorization_management.md",
          "clause_no": "第二条"
        },
        {
          "doc_id": "03_authorization_management.md",
          "clause_no": "附件二"
        }
      ],
      "facts": [
        "2022版旧制度(XX证财规〔2022〕乙号)第二条规定单笔报销≥8000元需部门总经理审批，第三条≥30000元需分管副总审批",
        "2025版现行制度(XX证财规〔2025〕甲号)第五条明确审批权限不再列示具体金额，统一按《授权管理办法》附件二执行",
        "2025版第十四条明确废止2022版旧制度，自2025年1月1日起施行",
        "《授权管理办法》附件二将审批线调整为：AR-02(3000-10000元)→部门经理+财务复核; AR-03(10000-50000元)→部门总经理; AR-04(50000-200000元)→分管副总",
        "旧版8000元门槛在现行制度中已被AR-03的10000元门槛取代，8000-9999元区间从旧版的'部门总经理'降为现行'部门经理+财务复核'",
        "旧版30000元门槛在现行制度中已被AR-04的50000元门槛取代，30000-49999元区间从旧版的'分管副总'降为现行'部门总经理'",
        "R004233金额9990元按现行AR-02(3000-10000)获得部门经理审批，合规；但若误用旧版8000元门槛则会误判为缺失部门总经理审批"
      ],
      "fact_supported": true,
      "rule_supported": true,
      "coverage_status": "pass"
    }
  ],
  "candidate_record_ids": [
    "R004233"
  ],
  "submitted_record_ids": [
    "R004233"
  ],
  "unowned_record_ids": [],
  "unused_candidate_record_ids": [],
  "unused_citations": [],
  "missing_evidence": [],
  "no_anomaly_coverage": {},
  "reconciled_figures": {
    "trap_zone_1": {
      "range": "8000-9999元",
      "old_rule": "部门总经理",
      "new_rule": "部门经理+财务复核(AR-02)",
      "example_record": "R004233"
    },
    "trap_zone_2": {
      "range": "30000-49999元",
      "old_rule": "分管副总",
      "new_rule": "部门总经理(AR-03)",
      "records_found": 0
    }
  },
  "unresolved_items": []
}