{
  "status": "pass",
  "coverage_percent": 100,
  "evidence_rows": [],
  "candidate_record_ids": ["R004234", "R004235"],
  "submitted_record_ids": ["R004234", "R004235"],
  "unowned_record_ids": [],
  "unused_candidate_record_ids": [],
  "unused_citations": [],
  "missing_evidence": [],
  "no_anomaly_coverage": {
    "complete": true
  },
  "reconciled_figures": {},
  "unresolved_items": []
}
