{
  "status": "pass",
  "coverage_percent": 100,
  "evidence_rows": [],
  "candidate_record_ids": ["R004236", "R004237"],
  "submitted_record_ids": ["R004236", "R004237"],
  "unowned_record_ids": [],
  "unused_candidate_record_ids": [],
  "unused_citations": [],
  "missing_evidence": [],
  "no_anomaly_coverage": {
    "description": "R004236与R004237的费用发生日期（2025-10-01和2025-10-09）间隔为8天，不满足制度第十一条的7天内条件，故不构成拆分报销异常，无需异常项证据覆盖。",
    "records_checked": ["R004236", "R004237"],
    "conclusion": "无异常"
  },
  "reconciled_figures": {},
  "unresolved_items": []
}
