{
  "status": "pass",
  "coverage_percent": 100,
  "evidence_rows": [
    {
      "anomaly_id": "L2-008-SPLIT-001",
      "record_ids": ["R004212", "R004213"],
      "citations": [
        {"doc_id": "01_expense_reimbursement_2025.md", "clause_no": "第十一条"},
        {"doc_id": "03_authorization_management.md", "clause_no": "附件二"}
      ],
      "facts": [
        "R004212: 员工E0009张婷，travel_lodging，¥5,100，2025-04-10，7晚，供应商安程酒店管理有限公司，城市档位A，事由'项目现场住宿费'，审批仅部门经理(E0009自批)",
        "R004213: 员工E0009张婷，travel_lodging，¥5,100，2025-04-15，7晚，供应商安程酒店管理有限公司，城市档位A，事由'项目现场住宿费'，审批仅部门经理(E0009自批)",
        "两笔报销间隔5天，在7天窗口内(2025-04-10至2025-04-15)",
        "合计金额¥10,200，达到AR-03档位(≥¥10,000)，需部门总经理审批",
        "单笔¥5,100属AR-02档位(¥3,000-¥10,000)，要求部门经理+财务复核，但两笔均仅有部门经理审批且为自批"
      ],
      "fact_supported": true,
      "rule_supported": true,
      "coverage_status": "pass"
    }
  ],
  "candidate_record_ids": ["R004212", "R004213"],
  "submitted_record_ids": ["R004212", "R004213"],
  "unowned_record_ids": [],
  "unused_candidate_record_ids": [],
  "unused_citations": [],
  "missing_evidence": [],
  "no_anomaly_coverage": {"complete": false},
  "reconciled_figures": {"total_anomalies": 1, "total_records": 2},
  "unresolved_items": []
}
