{
  "status": "pass",
  "coverage_percent": 100,
  "evidence_rows": [
    {
      "anomaly_id": "L3-001-DUP-001",
      "record_ids": ["R000002", "R004201"],
      "citations": [
        {"doc_id": "01_expense_reimbursement_2025.md", "clause_no": "第十条"}
      ],
      "facts": [
        "发票FP202500000002(INV000002)在报销记录R000002和R004201中重复使用,两笔报销均已批准,金额均为423.79元,报销人为同一员工E0050(姚瑜)",
        "R004201申报理由明确标注'重复发票注入样本',证实为同一发票的二次报销"
      ],
      "fact_supported": true,
      "rule_supported": true,
      "coverage_status": "pass"
    },
    {
      "anomaly_id": "L3-001-DUP-002",
      "record_ids": ["R000005", "R004202"],
      "citations": [
        {"doc_id": "01_expense_reimbursement_2025.md", "clause_no": "第十条"}
      ],
      "facts": [
        "发票FP202500000005(INV000005)在报销记录R000005和R004202中重复使用,两笔报销均已批准,金额均为88.83元,报销人为同一员工E0022(刘冬梅)",
        "R004202申报理由明确标注'重复发票注入样本',证实为同一发票的二次报销"
      ],
      "fact_supported": true,
      "rule_supported": true,
      "coverage_status": "pass"
    },
    {
      "anomaly_id": "L3-001-DUP-003",
      "record_ids": ["R000020", "R004203"],
      "citations": [
        {"doc_id": "01_expense_reimbursement_2025.md", "clause_no": "第十条"}
      ],
      "facts": [
        "发票FP202500000020(INV000020)在报销记录R000020和R004203中重复使用,两笔报销均已批准,金额均为669.50元,报销人为同一员工E0028(杜丹)",
        "R004203申报理由明确标注'重复发票注入样本',证实为同一发票的二次报销"
      ],
      "fact_supported": true,
      "rule_supported": true,
      "coverage_status": "pass"
    },
    {
      "anomaly_id": "L3-001-DUP-004",
      "record_ids": ["R000028", "R004204"],
      "citations": [
        {"doc_id": "01_expense_reimbursement_2025.md", "clause_no": "第十条"}
      ],
      "facts": [
        "发票FP202500000028(INV000028)在报销记录R000028和R004204中重复使用,两笔报销均已批准,金额均为165.58元,报销人为同一员工E0036(张林)",
        "R004204申报理由明确标注'重复发票注入样本',证实为同一发票的二次报销"
      ],
      "fact_supported": true,
      "rule_supported": true,
      "coverage_status": "pass"
    },
    {
      "anomaly_id": "L3-001-DUP-005",
      "record_ids": ["R000037", "R004205"],
      "citations": [
        {"doc_id": "01_expense_reimbursement_2025.md", "clause_no": "第十条"}
      ],
      "facts": [
        "发票FP202500000037(INV000037)在报销记录R000037和R004205中重复使用,两笔报销均已批准,金额均为84.72元,报销人为同一员工E0027(唐静)",
        "R004205申报理由明确标注'重复发票注入样本',证实为同一发票的二次报销"
      ],
      "fact_supported": true,
      "rule_supported": true,
      "coverage_status": "pass"
    },
    {
      "anomaly_id": "L3-001-DUP-006",
      "record_ids": ["R000055", "R004206"],
      "citations": [
        {"doc_id": "01_expense_reimbursement_2025.md", "clause_no": "第十条"}
      ],
      "facts": [
        "发票FP202500000055(INV000055)在报销记录R000055和R004206中重复使用,两笔报销均已批准,金额均为999.76元,报销人为同一员工E0020(陈洋)",
        "R004206申报理由明确标注'重复发票注入样本',证实为同一发票的二次报销"
      ],
      "fact_supported": true,
      "rule_supported": true,
      "coverage_status": "pass"
    }
  ],
  "candidate_record_ids": [],
  "submitted_record_ids": ["R000002","R004201","R000005","R004202","R000020","R004203","R000028","R004204","R000037","R004205","R000055","R004206"],
  "unowned_record_ids": [],
  "unused_candidate_record_ids": [],
  "unused_citations": [],
  "missing_evidence": [],
  "no_anomaly_coverage": {},
  "reconciled_figures": {},
  "unresolved_items": []
}
